{"version":2,"revision":1,"document":{"nodes":{"node-move-test":{"kind":"node","icon":"","label":"Move Test Node","x":200,"y":150,"width":80,"height":40,"locked":false,"tags":[],"metadata":{},"z_index":1}},"edges":{}},"editor_state":{"camera_x":0,"camera_y":0,"zoom":1,"grid_size":20,"snap_to_grid":true,"selected_items":["node-move-test"],"editing_edge_id":null,"theme":"system","show_grid":true,"minimap_visible":false}}
