{"version":2,"revision":0,"document":{"nodes":{"node-resize-test":{"kind":"node","icon":"","label":"Resize Test Node","x":100,"y":100,"width":80,"height":40,"locked":false,"tags":[],"metadata":{},"z_index":1}},"edges":{}},"editor_state":{"camera_x":0,"camera_y":0,"zoom":1,"grid_size":20,"snap_to_grid":true,"selected_items":["node-resize-test"],"editing_edge_id":null,"theme":"system","show_grid":true,"minimap_visible":false}}
